{
  "schema_version": "reagent.capsule-installation-ack/v0.1",
  "installation_id": "install-88888888888888888888888888888888",
  "project_id": "project-11111111111111111111111111111111",
  "workspace_id": "workspace-22222222222222222222222222222222",
  "manifest_revision": 1,
  "manifest_checksum": "sha256:dddddddddddddddddddddddddddddddddddddddddddddddddddddddddddddddd",
  "plan_checksum": "sha256:ffffffffffffffffffffffffffffffffffffffffffffffffffffffffffffffff",
  "installed_lock_checksum": "sha256:eeeeeeeeeeeeeeeeeeeeeeeeeeeeeeeeeeeeeeeeeeeeeeeeeeeeeeeeeeeeeeee",
  "status": "ACK_PENDING",
  "installed_capsules": [
    {
      "workflow_instance_id": "wfi-33333333333333333333333333333333",
      "capsule_id": "capsule-44444444444444444444444444444444",
      "capsule_version": "0.5.0",
      "definition_checksum": "sha256:aaaaaaaaaaaaaaaaaaaaaaaaaaaaaaaaaaaaaaaaaaaaaaaaaaaaaaaaaaaaaaaa"
    }
  ],
  "installed_at": "2026-08-06T12:15:00Z"
}
